,Date,In reality,Link,PolitiFact source,Score,Source,Statement
350,"on Wednesday, August 23rd, 2017",Too early to call,/punditfact/statements/2017/aug/23/david-frum/are-trumps-travels-imposing-historic-costs-taxpaye/,— PunditFact,Mostly False,David Frum,"""No president in history has imposed larger personal lifestyle costs on the taxpayer than Donald Trump."""
351,"on Wednesday, August 23rd, 2017",More fake details courtesy of trolls,/punditfact/statements/2017/aug/23/blog-posting/barcelona-terrorist-related-barack-obama-fake-news/,— PunditFact,Pants on Fire!,Bloggers,"Says ""Barcelona terrorist"" is cousins with former President Barack Obama."
352,"on Wednesday, August 23rd, 2017","A fake quote, a fake child",/punditfact/statements/2017/aug/23/blog-posting/fake-news-rosa-parks-had-no-daughter-could-praise-/,— PunditFact,Pants on Fire!,Bloggers,"""Rosa Parks’ daughter praises (President Donald) Trump’s response to Charlottesville."""
353,"on Monday, August 21st, 2017",Details falsely related and conflated,/punditfact/statements/2017/aug/21/blog-posting/story-obama-supporter-was-behind-wheel-car-charlot/,— PunditFact,Pants on Fire!,Bloggers,"""White supremacist who killed protester is a Democrat and visited (President Barack) Obama in Oval Office."""
354,"on Sunday, August 20th, 2017","They are up for some, but not that much",/punditfact/statements/2017/aug/20/alex-castellanos/death-rates-white-men-20-percent-gop-strategist-sa/,— PunditFact,Mostly False,Alex Castellanos,"""(For) white working-class America, death rates among white men are up 20 percent."""
355,"on Friday, August 18th, 2017",Craigslist ad for different city proves nothing,/punditfact/statements/2017/aug/18/blog-posting/blog-posts-wrongly-say-theres-proof-democrats-hire/,— PunditFact,False,Bloggers,Says there is proof Democrats hired actors to plan violence in Charlottesville.
356,"on Thursday, August 17th, 2017",Slavery continued for decades after Civil War,/punditfact/statements/2017/aug/17/tucker-carlson/tucker-carlson-wrongly-says-united-states-ended-sl/,— PunditFact,Pants on Fire!,Tucker Carlson,"""The United States ended slavery around the world, and maybe we should get some credit for that, too."""
357,"on Wednesday, August 16th, 2017",Outspoken Trump critic targeted again,/punditfact/statements/2017/aug/16/blog-posting/fake-news-wrongly-says-whoopi-goldberg-arrested-ru/,— PunditFact,Pants on Fire!,Bloggers,"""Whoopi Goldberg humiliated, handcuffed and dragged out of the TV studio."""
358,"on Tuesday, August 15th, 2017","Decades before the the '60s, actually",/punditfact/statements/2017/aug/15/joy-reid/did-confederate-symbols-gain-prominence-civil-righ/,— PunditFact,Mostly False,Joy Reid,"""The idea of putting up (Confederate) monuments actually didn’t happen right after the Civil War. It happened during the 1960s."""
359,"on Monday, August 14th, 2017",False details about falsely accused man,/punditfact/statements/2017/aug/14/puppetstringnewscom/charlottesville-hit-and-run-driver-was-anti-fascis/,— PunditFact,Pants on Fire!,PuppetStringNews.com,"""Charlottesville car attacker is anti-Trump Antifa supporter."""
360,"on Monday, August 14th, 2017",Fake news to shift the blame from alt right,/punditfact/statements/2017/aug/14/puppetstringnewscom/post-wrongly-says-charlottesville-police-arrested-/,— PunditFact,Pants on Fire!,PuppetStringNews.com,"""Virginia police arrest wrong person to cover for Antifa member who ran over protesters."""
361,"on Monday, August 14th, 2017",Jones said neo-Nazis were from 'central casting',/punditfact/statements/2017/aug/14/alex-jones/infowars-alex-jones-falsely-says-george-soros-hill/,— PunditFact,Pants on Fire!,Alex Jones,"Emails show Democrats, Hillary Clinton and George Soros instigated and orchestrated racial protests in Charlottesville by trying to ""control"" and keep people ""desperate."""
362,"on Monday, August 14th, 2017",The group that filed WANTS Johnson to run,/punditfact/statements/2017/aug/14/rearfrontcom/did-dwayne-rock-johnson-officially-file-run-presid/,— PunditFact,False,Rearfront.com,"""Dwayne 'The Rock' (Johnson) Has Officially Filed For The 2020 Presidential Campaign"""
363,"on Thursday, August 10th, 2017",Steals from real-life events,/punditfact/statements/2017/aug/10/blog-posting/its-fake-news-barron-trump-was-hospitalized-pneumo/,— PunditFact,Pants on Fire!,Bloggers,"""Barron Trump Rushed To The Hospital, Hospital Releases Statement On His Condition"""
364,"on Thursday, August 10th, 2017","Toto, I have a feeling this is fake news",/punditfact/statements/2017/aug/10/blog-posting/no-tornado-did-not-carry-mobile-home-130-miles-awa/,— PunditFact,Pants on Fire!,Bloggers,"Tornado carries mobile home 130 miles, family inside unharmed."
365,"on Wednesday, August 9th, 2017",Terms of the pact were never fulfilled,/punditfact/statements/2017/aug/09/viral-image/viral-image-wrongly-blames-bill-clinton-giving-nor/,— PunditFact,False,Viral image,"""Bill Clinton gave North Korea $5 billion and two nuclear reactors in 1994, essentially giving them nukes."""
366,"on Wednesday, August 9th, 2017",As fake as it gets,/punditfact/statements/2017/aug/09/blog-posting/fake-news-claim-trump-arrests-top-obama-officials-/,— PunditFact,Pants on Fire!,Bloggers,"Says President Donald ""Trump orders 13 Obama deep state operatives arrested for treason."""
367,"on Tuesday, August 8th, 2017",Navy Day speech didn't focus on pontiff,/punditfact/statements/2017/aug/08/blog-posting/vladimir-putin-said-pope-francis-not-man-god-blogg/,— PunditFact,Pants on Fire!,Bloggers,"Says Russian President Vladimir Putin said Pope Francis ""is not a man of God."""
368,"on Monday, August 7th, 2017",No pilot blamed for freak naval disaster,/punditfact/statements/2017/aug/07/blog-posting/posts-blame-john-mccain-deadly-1967-fire-aboard-us/,— PunditFact,Pants on Fire!,Bloggers,"U.S. Sen. John McCain ""was singlehandedly responsible for starting a fire on (the) USS Forrestal aircraft carrier."""
369,"on Friday, August 4th, 2017",Dear leader's death is a favored subject,/punditfact/statements/2017/aug/04/blog-posting/fake-news-site-posts-north-koreas-kim-jong-un-dead/,— PunditFact,Pants on Fire!,Bloggers,"""Kim Jong Un killed in (President Donald) Trump’s overnight black op attack on North Korea."""
370,"on Thursday, August 3rd, 2017",Another death hoax perpetrated by trolls,/punditfact/statements/2017/aug/03/blog-posting/hillary-clinton-not-dead-heart-attack-fake-news-si/,— PunditFact,Pants on Fire!,Bloggers,"""Hillary Clinton has third heart attack — docs says she ‘won’t survive’."""
371,"on Thursday, August 3rd, 2017",News articles updated without mention of Obamacare,/punditfact/statements/2017/aug/03/blog-posting/blog-posts-dont-update-bad-details-about-couples-s/,— PunditFact,False,Bloggers,"Says a New York physician and his wife jumped to their deaths because they ""can’t afford"" Obamacare."
372,"on Thursday, August 3rd, 2017",A convoluted case of opposition research,/punditfact/statements/2017/aug/03/blog-posting/internet-post-misleads-saying-witness-will-testify/,— PunditFact,False,Bloggers,"""A witness will testify against Hillary Clinton."""
373,"on Monday, July 31st, 2017",'Harry Potter' author retweeted edited video,/punditfact/statements/2017/jul/31/jk-rowling/jk-rowling-falsely-accuses-trump-not-shaking-disab/,— PunditFact,Pants on Fire!,J.K. Rowling,"Says Donald Trump was seen ""looking deliberately over a disabled child's head, ignoring his outstretched hand."""
374,"on Friday, July 28th, 2017",Obama tweeted only support for McCain,/punditfact/statements/2017/jul/28/blog-posting/fake-tweet-said-obama-hoped-mccain-would-die-brain/,— PunditFact,Pants on Fire!,Bloggers,"""Barack Obama tweets sick attack on John McCain, says he should have died."""
375,"on Wednesday, July 26th, 2017",Still in USA,/punditfact/statements/2017/jul/26/blog-posting/did-cher-move-canada-because-donald-trump/,— PunditFact,False,Bloggers,"Cher ""is moving to Canada because of President Trump."""
376,"on Wednesday, July 26th, 2017",Bogus story from bogus site,/punditfact/statements/2017/jul/26/blog-posting/its-fake-news-obama-seized-russian-mansions-gifts-/,— PunditFact,Pants on Fire!,Bloggers,"""Russian mansions Obama seized were meant to be illegal gifts to Sasha and Malia"""
377,"on Monday, July 24th, 2017",Guns came first by four centuries,/punditfact/statements/2017/jul/24/blog-posting/no-gretchen-carlson-didnt-say-2nd-amendment-writte/,— PunditFact,Pants on Fire!,Bloggers,"Say Gretchen Carlson said, ""The 2nd Amendment Was Written Before Guns Were Invented."""
378,"on Monday, July 24th, 2017",Sprints away from reality,/punditfact/statements/2017/jul/24/blog-posting/fake-newsoscar-pistorius-did-not-commit-suicide/,— PunditFact,Pants on Fire!,Bloggers,"Say Oscar Pistorius ""commits suicide in prison."""
379,"on Monday, July 24th, 2017",There's something rotten about this claim,/punditfact/statements/2017/jul/24/blog-posting/13-million-crops-rotted-calif-because-no-one-wante/,— PunditFact,Half-True,Bloggers,"""Over $13 million worth of crops have ROTTED in California, all because no one is willing to work jobs vacated by migrants."""
380,"on Friday, July 21st, 2017",He used a Soviet translator with Brezhnev,/punditfact/statements/2017/jul/21/ian-bremmer/nixon-sometimes-met-leaders-without-his-own-transl/,— PunditFact,True,Ian Bremmer,Says President Richard Nixon held meetings with heads of state without an American interpreter.
381,"on Thursday, July 20th, 2017",He's alive!,/punditfact/statements/2017/jul/20/blog-posting/its-fake-news-american-killed-north-koreas-leader-/,— PunditFact,Pants on Fire!,Bloggers,"""Kim Jong Un dead: North Koreans calling Trump an assassin"""
382,"on Tuesday, July 18th, 2017",Outdated statistics,/punditfact/statements/2017/jul/18/george-will/do-tax-preparers-outnumber-firefighters-and-police/,— PunditFact,False,George Will,"""America has more people employed as tax preparers (1.2 million) than as police and firefighters."""
383,"on Tuesday, July 18th, 2017",Shep Smith still at Fox,/punditfact/statements/2017/jul/18/blog-posting/no-fox-news-anchor-shepard-smith-did-not-punch-sea/,— PunditFact,Pants on Fire!,Bloggers,Shepard Smith was fired from Fox News.
384,"on Tuesday, July 18th, 2017",Revives a dodgy story,/punditfact/statements/2017/jul/18/greg-gutfeld/fox-news-host-cites-ted-kennedy-kgb-meeting-never-/,— PunditFact,False,Greg Gutfeld,"Says Ted Kennedy met ""with the KGB in order to beat Ronald Reagan in 1984."""
385,"on Tuesday, July 18th, 2017",Filing a made-up flight plan,/punditfact/statements/2017/jul/18/blog-posting/fake-news-saga-claims-paul-ryan-attended-loretta-l/,— PunditFact,Pants on Fire!,Bloggers,"""There was someone else on that plane for the secret Bill Clinton/Loretta Lynch meeting."""
386,"on Tuesday, July 18th, 2017","No bust, old internship",/punditfact/statements/2017/jul/18/freedomcrossroadsus/no-malia-obama-wasnt-fired-smoking-marijuana/,— PunditFact,Pants on Fire!,FreedomCrossroads.us,"""Malia Obama Fired From Cushy Internship At Spanish Embassy"""
387,"on Monday, July 17th, 2017",A parody site cooks up a bogus story,/punditfact/statements/2017/jul/17/halfwaypostcom/white-house-chefs-faux-resignation-fake-news-menu/,— PunditFact,Pants on Fire!,HalfwayPost.com,"""White House chef quits because Trump has only eaten fast food for 6 months."""
388,"on Friday, July 14th, 2017","He wants to celebrate, but should slow his roll",/punditfact/statements/2017/jul/14/kid-rock/kid-rock-announces-us-senate-run-needs-check-rules/,— PunditFact,Half-True,Kid Rock,"""I’ve got 15 days from my announcement to file paperwork with the FEC!"""
389,"on Friday, July 14th, 2017","Big Apple, not Sunshine State",/punditfact/statements/2017/jul/14/corey-lewandowski/lewandowski-wrongly-says-trump-florida-day-trump-t/,— PunditFact,False,Corey Lewandowski,"Says ""Donald Trump was doing a rally in the state of Florida"" the day Trump's son and others met with a Russian lawyer in New York."
390,"on Friday, July 14th, 2017",Fake ... and a clickbait retread,/punditfact/statements/2017/jul/14/uspoln/no-bachmann-didnt-say-whites-suffered-more-under-o/,— PunditFact,Pants on Fire!,Uspoln Website,"Says former Rep. Michele Bachmann said that ""White People Have Suffered More In The Last 8 Years Than Blacks Did During Couple Years Of Slavery."""
391,"on Thursday, July 13th, 2017",The trolls target House minority leader again,/punditfact/statements/2017/jul/13/blog-posting/fake-news-saga-wrongly-says-nancy-pelosis-daughter/,— PunditFact,Pants on Fire!,Bloggers,Says two of U.S. Rep. Nancy Pelosi’s daughters were arrested for smuggling drugs.
392,"on Wednesday, July 12th, 2017",Related conduct can be a crime,/punditfact/statements/2017/jul/12/eric-bolling/collusion-not-illegal-fox-news-host-eric-bolling-s/,— PunditFact,Mostly False,Eric Bolling,"""Collusion is not illegal."""
393,"on Wednesday, July 12th, 2017","Fake shark attacks, fake catch",/punditfact/statements/2017/jul/12/blog-posting/its-fake-news-3000-pound-shark-was-caught-lake-mic/,— PunditFact,Pants on Fire!,Bloggers,"""3,000-Pound Great White Shark Captured in Great Lakes."""
394,"on Tuesday, July 11th, 2017",Obama isn't stalking Trump,/punditfact/statements/2017/jul/11/blog-posting/no-obama-did-not-follow-trump-g20-summit-germany/,— PunditFact,Pants on Fire!,Bloggers,"""Obama goes to G20 summit ...  Everywhere President Donald Trump goes, Obama shows up, too."""
395,"on Tuesday, July 11th, 2017",From a website that hides facts too well,/punditfact/statements/2017/jul/11/newslocom/fake-news-story-twists-paul-ryans-words-poor-peopl/,— PunditFact,Pants on Fire!,Newslo.com,"Says Paul Ryan said that 22 million Americans ""choose to be poor, so it’s their own problem if they can’t afford to be healthy."""
396,"on Monday, July 10th, 2017",Comes from a trolling parody site,/punditfact/statements/2017/jul/10/freedomcrossroadsus/its-fake-news-james-comey-and-debbie-wasserman-sch/,— PunditFact,Pants on Fire!,FreedomCrossroads.us,"Says ""James Comey Has Been Having An Affair With"" Debbie Wasserman Schultz."
397,"on Friday, July 7th, 2017","Different countries, different situations",/punditfact/statements/2017/jul/07/hagar-chemali/are-sanctions-against-cuba-tougher-they-are-north-/,— PunditFact,Half-True,Hagar Chemali,"""Cuba is far more sanctioned than North Korea."""
398,"on Thursday, July 6th, 2017",False story from a parody site,/punditfact/statements/2017/jul/06/blog-posting/its-fake-news-president-can-disband-supreme-court/,— PunditFact,Pants on Fire!,Bloggers,"Spicer: ""Trump has the legal right to cancel SCOTUS because they serve at his pleasure"""
399,"on Thursday, July 6th, 2017",Fishy chips,/punditfact/statements/2017/jul/06/blog-posting/no-australian-government-not-installing-microchips/,— PunditFact,Pants on Fire!,Bloggers,Australia is microchipping its public.
400,"on Thursday, July 6th, 2017",Website let readers make their own fake news,/punditfact/statements/2017/jul/06/channel24newscom/story-about-checkers-shooting-came-fake-news-gener/,— PunditFact,Pants on Fire!,Channel24News.com,"Says the manager of a Checkers in Miami Gardens, Fla., killed 10 employees."
401,"on Wednesday, July 5th, 2017",Paul Horner strikes again ,/punditfact/statements/2017/jul/05/stgeorgegazettecom/story-about-ryan-announcing-trumps-resignation-com/,— PunditFact,Pants on Fire!,StGeorgeGazette.com,"""Donald Trump plans to step down as President of the United States and resign from office within the next 30 days."""
402,"on Monday, July 3rd, 2017",Very fake news,/punditfact/statements/2017/jul/03/blog-posting/no-minnesota-did-not-pass-anti-blasphemy-law-s-isl/,— PunditFact,Pants on Fire!,Bloggers,Minnesota imposed an Islamic anti-blasphemy law.
403,"on Friday, June 30th, 2017",Keep dreaming,/punditfact/statements/2017/jun/30/blog-posting/no-leonardo-dicaprio-isnt-moving-orlando-suburb/,— PunditFact,Pants on Fire!,Bloggers,"""Leonardo DiCaprio explains why he’s moving to Casselberry, Florida."""
404,"on Wednesday, June 28th, 2017",Growth would be almost 60 percent under current law,/punditfact/statements/2017/jun/28/newt-gingrich/gingrich-misleads-point-house-bill-grows-medicaid-/,— PunditFact,Half-True,Newt Gingrich,"Under the House health care bill, Medicaid spending ""actually goes up 20 percent over the next 10 years."""
405,"on Wednesday, June 28th, 2017",Recycled post didn't give Gowdy the job,/punditfact/statements/2017/jun/28/snoopackcom/website-puts-fake-headline-old-post-supporting-tre/,— PunditFact,Pants on Fire!,Snoopack.com,"""Trey Gowdy is the new director of the FBI!"""
406,"on Tuesday, June 27th, 2017",Dead men tell no (true) tales,/punditfact/statements/2017/jun/27/blog-posting/fake-news-saga-said-depp-threatened-trump-died-fed/,— PunditFact,Pants on Fire!,Bloggers,Says Johnny Depp died after being apprehended for threatening President Donald Trump’s life.
407,"on Monday, June 26th, 2017",Another melodrama from the trolls,/punditfact/statements/2017/jun/26/freedomcrossroadsus/saga-bodies-found-barrels-clinton-property-fake-ne/,— PunditFact,Pants on Fire!,FreedomCrossroads.us,Says investigators have found remains of missing women in steel barrels buried on Bill and Hillary Clinton’s property.
408,"on Monday, June 26th, 2017",Bogus websites added the phony details,/punditfact/statements/2017/jun/26/blog-posting/fake-headline-muddles-real-story-man-cooked-death-/,— PunditFact,Pants on Fire!,Bloggers,"""Massive Bumble Bee recall after 2 employees admit cooking a man and mixing him with a batch of tuna."""
409,"on Sunday, June 25th, 2017",Other details undermine House clause,/punditfact/statements/2017/jun/25/kellyanne-conway/house-health-care-bill-allows-some-stay-medicaid-n/,— PunditFact,Mostly False,Kellyanne Conway,"""If you became a Medicaid recipient through the Obamacare expansion, you are grandfathered in."""
410,"on Wednesday, June 21st, 2017","Numbers are right, amnesty definition not settled",/punditfact/statements/2017/jun/21/ann-coulter/ann-coulter-says-trump-granted-amnesty-nearly-1000/,— PunditFact,Mostly True,Ann Coulter,"The Trump administration has granted amnesty to ""nearly 100,000 'Dreamers' """
411,"on Wednesday, June 21st, 2017",A circle of lies from parody site,/punditfact/statements/2017/jun/21/blog-posting/fake-post-about-franken-resigning-was-originally-f/,— PunditFact,Pants on Fire!,Bloggers,"""Libtard hero Al Franken forced to resign in disgrace."""
412,"on Wednesday, June 21st, 2017","Actually, Trump won by less than 2 points",/punditfact/statements/2017/jun/21/joy-reid/joy-ann-reid-mistakes-size-trump-victory-georgia-d/,— PunditFact,False,Joy Reid,"In the Georgia House district that hosted a special election on June 20, ""Trump won by 20+ points."""
413,"on Tuesday, June 20th, 2017","Stay calm, carry on",/punditfact/statements/2017/jun/20/miami-gazette/report-cannibals-arrested-florida-fake-news/,— PunditFact,Pants on Fire!,TheMiamiGazette.com,"""Cannibals arrested in Florida claim eating human flesh cures diabetes and depression"""
414,"on Tuesday, June 20th, 2017",Smart money says this is pretty fake,/punditfact/statements/2017/jun/20/londonwebnewscom/kellyanne-conway-did-not-say-liberal-women-hate-he/,— PunditFact,Pants on Fire!,LondonWebNews.com,"Says Kellyanne Conway said liberal women hate her because of her ""striking beauty and intellect."""
415,"on Tuesday, June 20th, 2017",A different site by a prolific fake news operator,/punditfact/statements/2017/jun/20/freedomcrossroadsus/fake-news-pelosi-had-breakdown-credited-familiar-t/,— PunditFact,Pants on Fire!,FreedomCrossroads.us,"""Nancy Pelosi suffers breakdown, taken from Capitol Hill on a stretcher."""
416,"on Thursday, June 15th, 2017","No evidence of ""political incitement""",/punditfact/statements/2017/jun/15/new-york-times-editorial-board/no-evidence-sarah-palins-pac-incited-shooting-rep-/,— PunditFact,False,New York Times Editorial Board,A political map circulated by Sarah Palin’s PAC incited Rep. Gabby Giffords’ shooting
417,"on Thursday, June 15th, 2017",Blog post skipped real research,/punditfact/statements/2017/jun/15/teddystickcom/maxine-waters-has-not-skipped-90-percent-congressi/,— PunditFact,Pants on Fire!,TeddyStick.com,"""Democrat Maxine Waters has shown up to only 10 percent of congressional meetings for 35 years."""
418,"on Wednesday, June 14th, 2017",An annual conjunction of the Internet and fake details.,/punditfact/statements/2017/jun/14/blog-posting/its-fake-nasa-never-said-earth-will-go-dark-15-day/,— PunditFact,Pants on Fire!,Bloggers,"""NASA confirms Earth will experience 15 days of darkness In November 2017."""
419,"on Wednesday, June 14th, 2017",There isn't even a senator by that name,/punditfact/statements/2017/jun/14/blog-posting/claim-democratic-senator-busted-dea-fake-news/,— PunditFact,Pants on Fire!,Bloggers,"""The DEA just raided a United States senator — Dems in a panic."""
420,"on Tuesday, June 13th, 2017",Try to realize the truth: There is no quote.,/punditfact/statements/2017/jun/13/blog-posting/keanu-reeves-did-not-give-long-speech-attributed-h/,— PunditFact,Pants on Fire!,Bloggers,"Says Keanu Reeves gave a speech that began, ""I cannot be part of a world where men dress their wives as prostitutes by showing everything that should be cherished ..."""
421,"on Monday, June 12th, 2017",Original post was on a parody site in 2015,/punditfact/statements/2017/jun/12/antinews/years-old-story-edward-snowden-can-prove-osama-bin/,— PunditFact,Pants on Fire!,AntiNews.in,"""Edward Snowden: Osama bin Laden is still alive living in the Bahamas."""
422,"on Wednesday, June 7th, 2017",From an entertainment and humor site,/punditfact/statements/2017/jun/07/vet-tv/idea-donald-trump-will-split-marines-navy-unfounde/,— PunditFact,Pants on Fire!,Vet TV,"""Trump Removing Marines From the Navy."""
423,"on Wednesday, June 7th, 2017",Let this story crash and burn,/punditfact/statements/2017/jun/07/daily-usa-update/actor-scott-baio-healthy-after-fake-news-report-hi/,— PunditFact,Pants on Fire!,Daily USA Update,"Says ""Scott Baio .. dies in small plane crash."""
424,"on Tuesday, June 6th, 2017",He didn't say that,/punditfact/statements/2017/jun/06/uspoln/no-trumps-reported-pick-usda-chief-scientist-did-n/,— PunditFact,Pants on Fire!,Uspoln Website,"""Trump’s Top Scientist Pick: ‘Scientists Are Just Dumb Regular People That Think Dinosaurs Existed And The Earth Is Getting Warmer’"""
425,"on Tuesday, June 6th, 2017",Rumors of Monica Lewinsky’s death have been greatly exaggerated,/punditfact/statements/2017/jun/06/blog-posting/no-monica-lewinsky-was-not-murdered-shes-aliveand-/,— PunditFact,Pants on Fire!,Bloggers,"Says ""Monica Lewinsky Found Dead"" in a burglary."
426,"on Friday, June 2nd, 2017",It's all hearsay,/punditfact/statements/2017/jun/02/kimberley-strassel/did-obama-seek-back-channel-talks-iran-during-his-/,— PunditFact,False,Kimberley Strassel,"In 2008, ""candidate Obama, he's not even president-elect, sends William Miller over to Iran to establish a back channel and let the Iranians know that should he win the election, they will have friendlier terms."""
427,"on Thursday, June 1st, 2017","Old claim resurfaces, still wrong",/punditfact/statements/2017/jun/01/uspoln/blogs-fabricate-marco-rubio-quote-about-putting-ra/,— PunditFact,Pants on Fire!,Uspoln Website,"""Rubio: ‘Rape victims should be in custody if there is suspicion that they’re planning abortion.’ """
428,"on Wednesday, May 31st, 2017",We open up the law books,/punditfact/statements/2017/may/31/gregg-jarrett/fox-news-hosts-wrong-no-law-forbids-russia-trump-c/,— PunditFact,False,Gregg Jarrett,"""You can collude all you want with a foreign government in an election. There's no such statute"" (that makes collusion a crime)."
429,"on Wednesday, May 31st, 2017",Did Trump sic government watchdog on Clinton? No,/punditfact/statements/2017/may/31/blog-posting/fake-story-about-president-trump-greenlighting-con/,— PunditFact,Pants on Fire!,Bloggers,President Trump greenlighted Congress to ramp up Clinton investigation.
430,"on Tuesday, May 30th, 2017","Made-up story, made-up quote",/punditfact/statements/2017/may/30/blog-posting/pants-fire-bloggers-claim-obama-canceled-trump-rev/,— PunditFact,Pants on Fire!,Bloggers,"President Donald Trump ""announced that he would reinstate a national day of remembrance for fallen officers that the traitor before him had done away with."""
431,"on Friday, May 26th, 2017",He doesn't even have a son named Terrence,/punditfact/statements/2017/may/26/blog-posting/fake-news-posts-say-us-rep-trey-gowdys-son-found-d/,— PunditFact,Pants on Fire!,Bloggers,"Says U.S. Rep. Trey Gowdy’s 8-year-old son found dead ""in a dumpster in D.C."""
432,"on Friday, May 26th, 2017",The investigator they cite recanted his story,/punditfact/statements/2017/may/26/patriotcriercom/conspiracy-theory-comey-hid-seth-richs-ties-wikile/,— PunditFact,Pants on Fire!,PatriotCrier.com,"""(James) Comey knew murdered DNC staffer, Seth Rich, was WikiLeaks source & covered it up for Hillary (Clinton)."""
433,"on Wednesday, May 24th, 2017","Lots of lounging, but no cannabis",/punditfact/statements/2017/may/24/blog-posting/persistent-story-about-nasa-paying-people-18000-li/,— PunditFact,Pants on Fire!,Bloggers,"""NASA will pay you $18,000 to stay in bed and smoke weed for 70 straight days."""
434,"on Tuesday, May 23rd, 2017",Site raises a red flag for its shtick,/punditfact/statements/2017/may/23/theredshtickcom/trump-calling-kfcs-col-sanders-civil-war-hero-was-/,— PunditFact,Pants on Fire!,TheRedShtick.com,"""Donald Trump praises Colonel Sanders for his service in the Civil War."""
