,Date,In reality,Link,PolitiFact source,Score,Source,Statement
597,"on Friday, February 12th, 2016",He never said that,/punditfact/statements/2016/feb/12/viral-image/facebook-post-incorrectly-quotes-mark-cuban-millen/,— PunditFact,Pants on Fire!,Viral image,"Quotes Mark Cuban as saying, ""I worry that millions of millennials are voting Democrat this year because they fact-check everything."""
598,"on Friday, February 5th, 2016","Baby, we don't ""beliebe"" it",/punditfact/statements/2016/feb/05/sarah-palin/sarah-palin-says-donald-trump-justin-bieber-once-s/,— PunditFact,False,Sarah Palin,"Says Donald Trump's conversion to pro-life beliefs are akin to Justin Bieber's, who said in the past that abortion ""was no big deal to him."""
599,"on Monday, February 1st, 2016",A rap battle straight out of the 15th century,/punditfact/statements/2016/feb/01/bob/bob-duels-with-neil-degrasse-tyson/,— PunditFact,Pants on Fire!,B.o.B.,"""You've been tremendously deceived"" by people who say the Earth is not flat."
600,"on Friday, January 29th, 2016","47 percent would support a socialist, 58 percent an atheist",/punditfact/statements/2016/jan/29/jennifer-granholm/jennifer-granholm-says-americans-would-rather-elec/,— PunditFact,True,Jennifer Granholm,"When a Gallup poll asked about presidential candidate characteristics, ""When they get to the question on, 'Would you vote for a socialist,' it is even less popular than voting for atheists."""
601,"on Thursday, January 28th, 2016",Not unprecedented,/punditfact/statements/2016/jan/28/fox-news-channel/how-often-do-presidential-candidates-skip-debates-/,— PunditFact,Half-True,Fox News Channel,"Donald Trump’s decision to skip the Fox News/Google debate in Des Moines ""is near unprecedented."""
602,"on Thursday, January 21st, 2016","Surveys say, this one goes down in flames",/punditfact/statements/2016/jan/21/mike-rogers/mike-rogers-says-trump-appeals-democrats-much-repu/,— PunditFact,Pants on Fire!,Mike Rogers,"""Donald Trump is appealing as much to Democrats as he is to Republicans."""
603,"on Tuesday, January 5th, 2016",Polls agree that statistic holds,/punditfact/statements/2016/jan/05/laura-ingraham/laura-ingraham-say-claim-90-support-gun-background/,— PunditFact,False,Laura Ingraham,"""The 90 percent statistic of supporting background checks, that's been debunked."""
604,"on Wednesday, December 30th, 2015","A component, but an awfully small one",/punditfact/statements/2015/dec/30/stephen-hayes/guantanamo-key-component-terrorist-propaganda/,— PunditFact,True,Stephen Hayes,"Guantanamo has ""never been a key component of ISIS or al-Qaida propaganda."""
605,"on Wednesday, December 9th, 2015",Only Trump's accountant knows for sure,/punditfact/statements/2015/dec/09/occupy-democrats/occupy-democrats-say-simple-investment-trumps-fath/,— PunditFact,False,Occupy Democrats,"""If Trump had just put his father’s money in a mutual fund ... he’d have $8 billion."""
606,"on Tuesday, December 8th, 2015",The White House explicitly addressed the threat,/punditfact/statements/2015/dec/08/joe-scarborough/joe-scarborough-says-days-after-paris-attack-white/,— PunditFact,False,Joe Scarborough,"In the weekend after the terrorist attacks in Paris, the White House said ""this couldn't happen in the United States. ISIS couldn't reach us here."""
607,"on Wednesday, December 2nd, 2015",Up and up,/punditfact/statements/2015/dec/02/bill-maher/bill-maher-cancer-drugs-cost-10000-month/,— PunditFact,Mostly True,Bill Maher,"""15 years ago, cancer drugs cost an average of $10,000 a year. Now it’s $10,000 a month."""
608,"on Monday, November 23rd, 2015","The figure is close for base Republicans, but not all Americans",/punditfact/statements/2015/nov/23/arsalan-iftikhar/do-59-percent-americans-believe-barack-obama-musli/,— PunditFact,False,Arsalan Iftikhar,"""59 percent of Americans today believe that Barack Obama is still a Muslim."""
609,"on Sunday, November 22nd, 2015",67 percent of less than 1 percent of refugees,/punditfact/statements/2015/nov/22/michael-needham/did-united-states-accept-two-thirds-worlds-refugee/,— PunditFact,Mostly False,Michael Needham,"In 2013, the United States ""accepted 67 percent of the world’s refugees."""
610,"on Thursday, November 19th, 2015","Simple math, but slippery numbers",/punditfact/statements/2015/nov/19/neil-cavuto/foxs-cavuto-stacks-medicare-spending-against-wealt/,— PunditFact,Mostly False,Neil Cavuto,Taking all the money of the top 1 percent wouldn’t keep Medicare going for three years.
611,"on Friday, November 13th, 2015",Sometimes the best-known story lines are wrong,/punditfact/statements/2015/nov/13/megyn-kelly/foxs-kelly-miscasts-mizzou-upheaval-work-small-gro/,— PunditFact,Half-True,Megyn Kelly,"""In a period of roughly 72 hours, a small group of angry black students managed to force the resignation of the two highest ranking officials at that school."""
612,"on Wednesday, November 11th, 2015",Caffeine overdose?,/punditfact/statements/2015/nov/11/joshua-feuerstein/evangelical-activist-focuses-lack-christmas-new-st/,— PunditFact,Pants on Fire!,Joshua Feuerstein,"Says that Starbucks took ""Christmas off of their brand new cups."""
613,"on Tuesday, November 10th, 2015",Most of the failed co-ops didn't last five years.,/punditfact/statements/2015/nov/10/ezekiel-emanuel/did-obamacare-insurance-co-ops-fail-faster-average/,— PunditFact,Half-True,Ezekiel Emanuel,"Obamacare insurance cooperative failures ""should be expected"" because they're like any business, and ""when you start businesses in America, at the fifth year, half of the businesses have closed."""
614,"on Wednesday, November 4th, 2015","Remember, there are 3 tickets out of Iowa",/punditfact/statements/2015/nov/04/trevor-noah/daily-shows-trevor-noah-says-iowa-gop-caucuses-don/,— PunditFact,Half-True,Trevor Noah,"""Iowa's Republican caucus stopped mattering years ago. It in no way determines the party nominee."""
615,"on Monday, October 26th, 2015",Hannity responds,/punditfact/statements/2015/oct/26/sean-hannity/250000-syrian-refugees-us-fact-check-trump-hannity/,— PunditFact,Pants on Fire!,Sean Hannity,"""The president said he’s going to bring in 250,000 (Syrian and Iraqi) refugees into this country."""
616,"on Sunday, October 25th, 2015",Though he has voted for the exception,/punditfact/statements/2015/oct/25/jennifer-granholm/liberal-pundit-marco-rubio-opposes-rape-incest-abo/,— PunditFact,Mostly True,Jennifer Granholm,"Says Marco Rubio opposes abortion ""even in the case of rape and incest."""
617,"on Thursday, October 22nd, 2015",A cigar mag interview that's full of smoke,/punditfact/statements/2015/oct/22/jon-voight/actor-jon-voight-says-progressive-just-another-wor/,— PunditFact,False,Jon Voight,"""The word progressive ... was created as a substitute for ‘communist’."""
618,"on Wednesday, October 21st, 2015",Graphic debunks itself,/punditfact/statements/2015/oct/21/viral-image/next-chapter-conspiracy-theiry-graphic-takes-aim-c/,— PunditFact,Pants on Fire!,Viral image,"""CNN's Crap Polling"" is so bad that it shows that ""no one under the age of 50 has an opinion of Hillary Clinton."""
619,"on Monday, October 19th, 2015","Calm down, Bernieverse. Poll is there",/punditfact/statements/2015/oct/19/nowthis/no-internet-cnn-did-not-delete-its-poll-showing-be/,— PunditFact,Pants on Fire!,NowThis,Says CNN deleted an online poll showing Bernie Sanders won the first Democratic presidential debate to help out Hillary Clinton.
620,"on Monday, October 12th, 2015",Polling's tough but it's not this bad yet,/punditfact/statements/2015/oct/12/steve-deace/conservative-steve-deace-says-pollsters-dont-trust/,— PunditFact,Half-True,Steve Deace,"Pollsters say ""don't actually believe our own data"" and Gallup stopped primary polling ""because they don't trust their methodology."""
621,"on Wednesday, October 7th, 2015",Made in the USA,/punditfact/statements/2015/oct/07/tweets/tweets-say-donald-trumps-make-america-great-again-/,— PunditFact,Pants on Fire!,Tweets,"Says Donald Trump’s ""Make America Great Again"" hats were made in China."
622,"on Tuesday, October 6th, 2015",Grim and largely accurate,/punditfact/statements/2015/oct/06/nicholas-kristof/nicholas-kristof-gun-deaths-preschoolers-police/,— PunditFact,Mostly True,Nicholas Kristof,"""More preschoolers are shot dead each year than police officers are in the line of duty."""
623,"on Monday, October 5th, 2015",She can't blame Twitter's character limit,/punditfact/statements/2015/oct/05/dana-loesch/Planned-parenthood-86-percent-abortion-revenue/,— PunditFact,False,Dana Loesch,"Says Planned Parenthood CEO Cecile Richards was ""forced to concede that 86 percent of Planned Parenthood’s revenue is from abortion."""
624,"on Monday, October 5th, 2015","Analysis is about where people bought guns, not if they bought legally",/punditfact/statements/2015/oct/05/joe-scarborough/msnbcs-joe-scarborough-tiny-fraction-crimes-commit/,— PunditFact,Half-True,Joe Scarborough,"About ""3 percent of murders and crimes are committed with guns from people who actually (legally) purchase those guns."""
625,"on Sunday, October 4th, 2015",Still a question without an answer,/punditfact/statements/2015/oct/04/mark-kelly/out-date-gun-background-check-statistic-gets-new-l/,— PunditFact,Half-True,Mark Kelly,"""We sell 40 percent of our guns without a background check."""
626,"on Thursday, October 1st, 2015",Over the top,/punditfact/statements/2015/oct/01/viral-image/viral-image-wrongly-accuses-clinton-stealing/,— PunditFact,Mostly False,Viral image,"Says after leaving the White House, Hillary Clinton ""was forced to return an estimated $200,000 in White House china, furniture and artwork that she had stolen."""
627,"on Wednesday, September 30th, 2015",Problems abound,/punditfact/statements/2015/sep/30/viral-image/viral-flawed-post-compares-honduras-switzerland-gu/,— PunditFact,Pants on Fire!,Viral image,"Honduras ""bans citizens from owning guns"" and has the ""highest homicide rate in the entire world."" Switzerland, with a similar population, ""requires citizens to own guns"" and has the ""lowest homicide rate in the entire world."""
628,"on Tuesday, September 29th, 2015",Long time gay rights supporter,/punditfact/statements/2015/sep/29/chuck-todd/nbcs-chuck-todd-bernie-sanders-there-same-sex-marr/,— PunditFact,True,Chuck Todd,"Says ""Bernie Sanders was there when it came to (same-sex) marriage 20 years ago. ... He was there when it wasn't popular."""
629,"on Friday, September 25th, 2015",Colbert isn't joking,/punditfact/statements/2015/sep/25/stephen-colbert/stephen-colbert-brings-ronald-reagans-tax-raising-/,— PunditFact,Mostly True,Stephen Colbert,"Says Ronald Reagan ""reversed his world’s ‘largest tax cut’ and raised taxes when revenues did not match the expectations."""
630,"on Thursday, September 24th, 2015","“He could have said, ‘A bar of gold cost $1 million, so Daraprim is underpriced' """,/punditfact/statements/2015/sep/24/martin-shkreli/fact-checking-martin-shkrelis-claim-daraprim-under/,— PunditFact,False,Martin Shkreli,"""Daraprim is still underpriced, relative to its peers."""
631,"on Tuesday, September 22nd, 2015",A meeting with many interpretations,/punditfact/statements/2015/sep/22/matthew-dowd/did-popes-namesake-st-francis-reach-out-muslims/,— PunditFact,Mostly True,Matthew Dowd,"Says Pope Francis ""took the name of a saint who basically reached out to Muslims."""
632,"on Sunday, September 20th, 2015",Whole lot of shakin' going on,/punditfact/statements/2015/sep/20/karl-rove/rove-says-2012-nomination-fight-saw-many-poll-lead/,— PunditFact,Mostly True,Karl Rove,"At this point in 2012, ""Rick Perry was ahead at 29.9 percent, and we had seven more leads before it finally settled on Mitt Romney."""
633,"on Wednesday, September 16th, 2015",Polls show public interest holds steady,/punditfact/statements/2015/sep/16/hugh-hewitt/hugh-hewitt-says-fall-sports-sap-public-interest-/,— PunditFact,Half-True,Hugh Hewitt,"Says history suggests sports will ""quickly subsume a lot of the attention span of the country"" in the presidential primary."
634,"on Tuesday, September 15th, 2015",No national poll shows this,/punditfact/statements/2015/sep/15/michele-bachmann/michele-bachmann-donald-trump-highest-hispanics-an/,— PunditFact,False,Michele Bachmann,"Says Donald Trump’s polling numbers show that he’s ""the highest with Hispanics that any Republican has ever been."""
635,"on Monday, September 14th, 2015",Judges and clerks have different jobs,/punditfact/statements/2015/sep/14/viral-image/conservative-facebook-post-faults-lesbian-texas-ju/,— PunditFact,False,Viral image,Says the case of a Texas judge who refused to perform heterosexual weddings exposes a double standard in the case against Kentucky clerk Kim Davis.
636,"on Friday, September 11th, 2015",Not her main job,/punditfact/statements/2015/sep/11/juan-williams/williams-clinton-was-decider-classified-info-state/,— PunditFact,Half-True,Juan Williams,"When it comes to classified information at the State Department, Hillary Clinton’s ""the decider."""
637,"on Thursday, September 10th, 2015","No hard polling data for ""every state""",/punditfact/statements/2015/sep/10/matthew-dowd/dowd-historic-polling-pattern-points-trump/,— PunditFact,Half-True,Matthew Dowd,"""Any Republican that has led for two months and led every state has won the GOP nomination."""
638,"on Tuesday, September 8th, 2015",Not well grounded in data,/punditfact/statements/2015/sep/08/jorge-ramos/ramos-40-undocumented-immigrants-come-air/,— PunditFact,Half-True,Jorge Ramos,"""Almost 40 percent of all (undocumented) immigrants come by plane and they overstay their visas."""
639,"on Thursday, September 3rd, 2015","First, 'Kenyan' is not a language",/punditfact/statements/2015/sep/03/viral-image/no-denali-not-kenyan-word-black-power/,— PunditFact,Pants on Fire!,Viral image,""" 'Denali' is the Kenyan word for 'black power.' """
640,"on Thursday, September 3rd, 2015",The treaty does nothing of the sort,/punditfact/statements/2015/sep/03/dick-cheney/cheney-slips-key-nuclear-treaty/,— PunditFact,False,Dick Cheney,"Under the Nuclear Nonproliferation Treaty ""enrichment has been limited to basically the weapons states."""
641,"on Thursday, September 3rd, 2015",His family fled to another part of the Roman Empire,/punditfact/statements/2015/sep/03/ryan-eller/jesus-was-undocumented-immigrant-ordained-minister/,— PunditFact,False,Ryan Eller,"""Jesus was an undocumented immigrant."""
642,"on Wednesday, September 2nd, 2015",Clinton's support last described as 'unenthusiastic',/punditfact/statements/2015/sep/02/viral-image/where-do-hillary-clinton-and-bernie-sanders-stand-/,— PunditFact,Mostly True,Viral image,"Bernie Sanders opposes the death penalty, and Hillary Clinton supports it."
643,"on Wednesday, September 2nd, 2015",MIA: Hillary's enthusiasm for TPP,/punditfact/statements/2015/sep/02/viral-image/how-bernie-sanders-hillary-clinton-differ-trans-pa/,— PunditFact,Mostly True,Viral image,"Bernie Sanders opposes the Trans-Pacific Partnership, and Hillary Clinton supports it."
644,"on Tuesday, September 1st, 2015",Data show the opposite,/punditfact/statements/2015/sep/01/eric-bolling/fox-news-bolling-misstates-tie-between-gun-laws-an/,— PunditFact,False,Eric Bolling,"""In countries where there are higher, more strict gun laws, there is more gun violence."""
645,"on Friday, August 28th, 2015",Low and outside,/punditfact/statements/2015/aug/28/curt-schilling/schilling-throws-wild-pitch-nazi-stat/,— PunditFact,Mostly False,Curt Schilling,"""In 1940, only 7 percent of Germans were Nazis."""
646,"on Thursday, August 27th, 2015",Claim still holds up,/punditfact/statements/2015/aug/27/nicholas-kristof/more-americans-killed-guns-1968-all-wars-says-colu/,— PunditFact,True,Nicholas Kristof,"""More Americans have died from guns in the United States since 1968 than on battlefields of all the wars in American history."""
647,"on Thursday, August 27th, 2015",Budget snapshots miss a lot of the picture,/punditfact/statements/2015/aug/27/occupy-democrats/liberal-group-blames-bush-raising-deficits-credits/,— PunditFact,Half-True,Occupy Democrats,"Says ""Bush Jr. handed Obama a $1.4 trillion deficit"" and Obama ""reduced Bush Jr.’s deficit to just $492 billion."""
648,"on Tuesday, August 25th, 2015",Dates show Jindal didn't matter,/punditfact/statements/2015/aug/25/occupy-democrats/liberal-group-tags-jindal-anchor-baby/,— PunditFact,Pants on Fire!,Occupy Democrats,"Says Bobby Jindal’s parents ""used his birthright citizenship to become Americans, making him an anchor baby."""
649,"on Tuesday, August 25th, 2015","Crime bill gets some, not all, blame",/punditfact/statements/2015/aug/25/julius-jones/black-lives-matter-activist-says-clintons-passed-p/,— PunditFact,Half-True,Julius Jones,"""The policy mistakes that ... the Clintons made got us, in large degree, to the situation that we are in today with mass incarceration."""
650,"on Sunday, August 23rd, 2015",An 'anomaly' among economic peers,/punditfact/statements/2015/aug/23/se-cupp/se-cupp-only-about-30-other-countries-offer-birthr/,— PunditFact,True,S.E. Cupp,"""There are actually only 30 countries that practice birthright citizenship."""
651,"on Thursday, August 20th, 2015","It's satire, people",/punditfact/statements/2015/aug/20/facebook-posts/no-michele-bachmann-did-not-say-there-are-no-illeg/,— PunditFact,Pants on Fire!,Facebook posts,"Says Michele Bachmann said, ""The Chinese built a Great Wall 5,000 years ago. You don't see any illegal Mexicans in China."""
652,"on Thursday, August 20th, 2015","Numbers right, but comparison imperfect",/punditfact/statements/2015/aug/20/matt-wuerker/has-us-really-spent-more-afghanistan-post-wwii-eur/,— PunditFact,Mostly True,Matt Wuerker,"""The U.S. has now spent more on reconstructing Afghanistan than was spent on the Marshall Plan and the reconstruction of Europe."""
653,"on Tuesday, August 18th, 2015",Examples are scant,/punditfact/statements/2015/aug/18/howard-dean/howard-dean-tremendous-number-public-officials-hav/,— PunditFact,Mostly False,Howard Dean,"""There’s a tremendous other number of public officials who have done the same thing"" as Hillary Clinton with a private email server."
654,"on Monday, August 17th, 2015",The man he cites says he got it wrong,/punditfact/statements/2015/aug/17/tom-tancredo/tancredo-muffs-illegal-immigrant-murder-stats/,— PunditFact,False,Tom Tancredo,"Between 2008 and 2014, ""criminal aliens accounted for 38 percent of all murder convictions in the five states of California, Texas, Arizona, Florida and New York."""
655,"on Wednesday, August 12th, 2015",Takin' it back to the USSR,/punditfact/statements/2015/aug/12/george-will/george-will-reminds-readers-about-bernie-sanders-u/,— PunditFact,Mostly True,George Will,"Says Bernie Sanders chose ""to spend his honeymoon in the Soviet Union in 1988."""
656,"on Tuesday, August 11th, 2015",Emails had few details,/punditfact/statements/2015/aug/11/andrew-napolitano/did-hillary-clinton-emails-reveal-location-ambassa/,— PunditFact,Half-True,Andrew Napolitano,"Emails released to the public show Hillary Clinton discussed ""the location of Ambassador Stevens, who of course was murdered, in Libya."""
657,"on Monday, August 10th, 2015",Not universal practices,/punditfact/statements/2015/aug/10/rafael-cruz/rafael-cruz-father-ted-cruz-says-everybody-prayed-/,— PunditFact,Mostly False,Rafael Cruz,"""Prior to 1962, everybody prayed before school started,"" and ""the Bible was the principal textbook in all schools."""
658,"on Sunday, August 9th, 2015",GOP won women by 1 percentage point in '88,/punditfact/statements/2015/aug/09/heather-mcghee/republican-presidential-nominee-hasnt-won-over-wom/,— PunditFact,True,Heather McGhee,"""The Republican presidential nominee hasn’t won women since 1988."""
659,"on Thursday, August 6th, 2015",Not a significant rewrite,/punditfact/statements/2015/aug/06/rachel-maddow/rachel-maddow-says-fox-changed-poll-eligibility-cr/,— PunditFact,Half-True,Rachel Maddow,"""Fox changed around their poll eligibility criteria on the day they announced who is in and out of their debate."""
660,"on Tuesday, August 4th, 2015",The Navy denies it in full,/punditfact/statements/2015/aug/04/allen-west/navy-officer-who-shot-chattanooga-shooter-facing-c/,— PunditFact,False,Allen West,"The Navy ""is bringing charges against"" a Navy officer who shot at the Chattanooga shooter ""for illegally discharging a firearm on federal property."""
661,"on Tuesday, August 4th, 2015",Selective reading of 'services',/punditfact/statements/2015/aug/04/sandra-smith/fox-business-reporter-95-planned-parenthoods-pregn/,— PunditFact,False,Sandra Smith,"""Almost 95 percent of all (Planned Parenthood) pregnancy services were abortions."""
662,"on Monday, August 3rd, 2015",Counting lions an inexact science,/punditfact/statements/2015/aug/03/jack-hanna/jack-hanna-talks-cecil-week-claims-africas-lion-po/,— PunditFact,Mostly True,Jack Hanna,"""In 1947, when I was born, there were about 450,000 lions. In the mid-70s, when my kids were born, there were about 100,000. Today, there are less than 30,000."""
663,"on Thursday, July 30th, 2015",Actions louder than words,/punditfact/statements/2015/jul/30/bill-oreilly/bill-oreilly-tells-huckabee-russia-china-said-clea/,— PunditFact,Mostly True,Bill O'Reilly,"Russia and China ""absolutely said pretty clearly"" they would not keep economic sanctions on Iran if the United States ""walked away from the deal."""
664,"on Thursday, July 30th, 2015","Literally, no",/punditfact/statements/2015/jul/30/harry-houck/former-nypd-detective-sandra-blands-traffic-stop-l/,— PunditFact,False,Harry Houck,"""The law says ... when a police officer stops you, do whatever he says and then deal with it later."""
665,"on Wednesday, July 29th, 2015",Huevos rancheros for thought,/punditfact/statements/2015/jul/29/jose-diaz-balart/majority-hispanic-population-us-born-says-jose-dia/,— PunditFact,True,Jose Diaz-Balart,"""The majority of the Hispanic population and the growth (of the population) is U.S.-born."""
666,"on Tuesday, July 28th, 2015",Meme has outrageous grip on facts,/punditfact/statements/2015/jul/28/occupy-democrats/house-republicans-attacked-passing-bill-makes-it-l/,— PunditFact,False,Occupy Democrats,"""House Republicans just passed a bill that makes it legal for single mothers to be fired by their employers."""
667,"on Tuesday, July 28th, 2015",The effort was state-sanctioned,/punditfact/statements/2015/jul/28/numbers-usa/did-more-half-all-california-drivers-licenses-go-u/,— PunditFact,Mostly True,NumbersUSA,"""More than half of all drivers' licenses issued in California this year have gone to illegal aliens."""
668,"on Monday, July 27th, 2015",Hard to regulate across state lines,/punditfact/statements/2015/jul/27/john-oliver/john-oliver-hits-regulatory-gap-food-last-week-ton/,— PunditFact,True,John Oliver,"""With the exception of baby formula, the federal government does not require any food to carry an expiration date, and state laws vary widely."""
669,"on Monday, July 27th, 2015",Ghost soldiers,/punditfact/statements/2015/jul/27/chuck-baldwin/no-300000-slave-owners-did-not-fight-union-side-ci/,— PunditFact,Pants on Fire!,Chuck Baldwin,"When President Abraham Lincoln signed his Emancipation Proclamation, ""there were over 300,000 slaveholders who were fighting in the Union army."""
670,"on Friday, July 24th, 2015",That was then. This is now.,/punditfact/statements/2015/jul/24/erick-erickson/conservative-columnist-trump-once-backed-single-pa/,— PunditFact,True,Erick Erickson,"Says Donald Trump ""has supported a Canadian-style universal health care system."""
671,"on Thursday, July 23rd, 2015","He's right in spirit, not in details",/punditfact/statements/2015/jul/23/jon-stewart/fact-checking-jon-stewarts-last-daily-show-intervi/,— PunditFact,Half-True,Jon Stewart,"The United States is ""fighting with Iraqis to defeat ISIS along with Iran. But in Yemen we're fighting Iran with Iraqis and Saudis."""
672,"on Wednesday, July 22nd, 2015","Frankly, it was a joke.",/punditfact/statements/2015/jul/22/rush-limbaugh/rush-limbaugh-al-franken-said-almost-exactly-what-/,— PunditFact,Half-True,Rush Limbaugh,"""Al Franken said almost exactly what Trump said"" about John McCain’s military record."
673,"on Tuesday, July 21st, 2015",Earth's demotion not guaranteed,/punditfact/statements/2015/jul/21/other-space/plutos-advocates-say-even-earth-would-not-count-pl/,— PunditFact,Half-True,Other Space,"""By declaring that Pluto was no longer a planet, the (International Astronomical Union) put into place a planetary definition that would have even declassified Earth as a planet if it existed as far from the sun as Pluto does."""
674,"on Tuesday, July 21st, 2015",This has been debunked,/punditfact/statements/2015/jul/21/pamela-geller/pam-geller-spreads-false-claim-about-isis-linked-t/,— PunditFact,False,Pamela Geller,"""ISIS supporter tweeted at 10:34 a.m. Shooting began at 10:45 a.m."" in Chattanooga, Tenn."
675,"on Friday, July 17th, 2015",Confuses GDP with tax revenues,/punditfact/statements/2015/jul/17/ron-dermer/israeli-ambassador-uses-odd-logic-relate-irans-fro/,— PunditFact,Mostly False,Ron Dermer,"""In a few months, this deal would give Iran $150 billion"" for its $300 billion to $400 billion economy, which is ""like $8 trillion flowing into the United States treasury."""
676,"on Friday, July 17th, 2015",Obama talks about it but hasn't scaled back THAT much,/punditfact/statements/2015/jul/17/dick-cheney/cheney-obama-wants-get-rid-all-nuclear-weapons-has/,— PunditFact,Mostly False,Dick Cheney,"""Obama keeps talking about getting rid of all nuclear weapons. He’s already significantly reduced our capabilities there."""
