,Date,In reality,Link,PolitiFact source,Score,Source,Statement
838,"on Sunday, November 9th, 2014",8 actually -- from three different agencies,/punditfact/statements/2014/nov/09/greta-van-susteren/claim-new-jersey-has-had-7-credit-downgrades-chris/,— PunditFact,Mostly True,Greta Van Susteren,"New Jersey has had ""seven credit downgrades"" since Chris Christie became governor."
839,"on Thursday, November 6th, 2014",People both trust and distrust Fox News,/punditfact/statements/2014/nov/06/leonard-pitts-jr/liberal-columnist-says-least-trusted-news-sources-/,— PunditFact,Half-True,"Leonard Pitts, Jr.","""America’s least-trusted news sources are also its most popular."""
840,"on Thursday, November 6th, 2014","Numbers uncertain, but experts give GOP edge",/punditfact/statements/2014/nov/06/joe-scarborough/which-side-spent-more-2014-midterms-democrats-or-r/,— PunditFact,Half-True,Joe Scarborough,"2014 midterm election spending by ""the left and the right are both equal."""
841,"on Wednesday, November 5th, 2014",An exercise in radically cherry-picked data,/punditfact/statements/2014/nov/05/ben-shapiro/shapiro-says-majority-muslims-are-radicals/,— PunditFact,False,Ben Shapiro,"""We’re above 800 million Muslims radicalized, more than half the Muslims on Earth That’s not a minority. That’s now a majority."""
842,"on Tuesday, November 4th, 2014",Studies agree: Uninsured rate is dropping,/punditfact/statements/2014/nov/04/herman-cain/herman-cain-says-more-losing-insurance-through-oba/,— PunditFact,False,Herman Cain,"""More people are losing their insurance (due to Obamacare) than are becoming newly insured."""
843,"on Sunday, November 2nd, 2014","For most Kansas senators, there's no place like the GOP",/punditfact/statements/2014/nov/02/jonathan-karl/last-time-kansans-elected-someone-other-republican/,— PunditFact,True,Jonathan Karl,"""Kansas has not elected somebody other than a Republican (to the U.S. Senate) since before 'The Wizard of Oz' hit the movie theaters."""
844,"on Thursday, October 30th, 2014",Not what 2013 law says,/punditfact/statements/2014/oct/30/megyn-kelly/megyn-kellys-errant-claim-about-colorado-voters-pr/,— PunditFact,False,Megyn Kelly,"A new Colorado law ""literally allows residents to print ballots from their home computers, then encourages them to turn ballots over to ‘collectors.’ """
845,"on Thursday, October 30th, 2014",It takes a lot of A/C to keep fans cool,/punditfact/statements/2014/oct/30/nicholas-kristof/kristof-dallas-cowboys-stadium-draws-3-times-more-/,— PunditFact,Mostly True,Nicholas Kristof,"""All of Liberia can produce less than one-third as much electricity as the Dallas Cowboys football stadium consumes at peak times."""
846,"on Tuesday, October 28th, 2014",Puffs up an old story,/punditfact/statements/2014/oct/28/tucker-carlson/carlson-democrats-use-newports-get-out-homeless-vo/,— PunditFact,Half-True,Tucker Carlson,"Democrats give ""Newports to the homeless to get them to the polls."""
847,"on Monday, October 27th, 2014",Cuts not for the faint of heart,/punditfact/statements/2014/oct/27/doug-muder/blog-sen-paul-wanted-big-cut-cdc-2011/,— PunditFact,True,Doug Muder,"Says Sen. Rand Paul’s 2011 budget ""included a big cut in the CDC."""
848,"on Friday, October 24th, 2014","Using a certain window, yes",/punditfact/statements/2014/oct/24/stephanie-cutter/stephanie-cutter-ebola-vaccine-research-was-cut-ha/,— PunditFact,Mostly True,Stephanie Cutter,"""Money towards the Ebola vaccine is basically cut in half to what it was. More cuts are coming under the congressional sequester."""
849,"on Thursday, October 23rd, 2014",Ignores a lot of training,/punditfact/statements/2014/oct/23/allen-west/do-us-troops-get-just-4-hours-ebola-training/,— PunditFact,Mostly False,Allen West,"""U.S. troops are getting only 4 hours of Ebola training before deployment to Liberia."""
850,"on Wednesday, October 22nd, 2014",16 to 22 is a better range,/punditfact/statements/2014/oct/22/corey-hebert/counting-number-ebola-outbreaks/,— PunditFact,Mostly True,Corey Hebert,"""We've had 27 (Ebola) outbreaks around the globe and they've never spread outside of the confines of the countries that were initially affected."""
851,"on Tuesday, October 21st, 2014",O'Reilly's appearances are a ratings factor,/punditfact/statements/2014/oct/21/bill-oreilly/bill-oreilly-says-lettermans-ratings-increase-when/,— PunditFact,Mostly True,Bill O'Reilly,"""When I go on Letterman"" the ""ratings go up."""
852,"on Sunday, October 19th, 2014",Ebola is the bigger humanitarian crisis,/punditfact/statements/2014/oct/19/tavis-smiley/tavis-smiley-says-ebola-outbreak-not-bad-sars-outb/,— PunditFact,Mostly False,Tavis Smiley,"""This (Ebola) is not as bad as SARS was in 2003."""
853,"on Sunday, October 19th, 2014",More like violent vomiting,/punditfact/statements/2014/oct/19/george-will/george-will-claims-sneeze-cough-spread-ebola/,— PunditFact,False,George Will,"Some doctors say Ebola can be transmitted through the air by ""a sneeze or some cough."""
854,"on Thursday, October 16th, 2014",Most mutations go nowhere,/punditfact/statements/2014/oct/16/glenn-beck/beck-warns-massive-mutations-ebola-virus/,— PunditFact,Half-True,Glenn Beck,"""Every time somebody new gets the Ebola virus, it mutates."""
855,"on Thursday, October 16th, 2014",Small changes in just a few states,/punditfact/statements/2014/oct/16/mark-shields/shields-gops-2010-statehouse-gains-eased-rules-gun/,— PunditFact,Mostly False,Mark Shields,"Republicans ""made it easier to buy a gun"" in states they won in 2010."
856,"on Tuesday, October 14th, 2014","Maybe when Trump travels, but not Obama",/punditfact/statements/2014/oct/14/donald-trump/trump-obama-fundraising-trip-cost-25-50-million/,— PunditFact,Pants on Fire!,Donald Trump,"Says President Barack Obama’s recent New York fundraising trip ""cost between $25 million and $50 million."""
857,"on Sunday, October 12th, 2014",Social science without the science,/punditfact/statements/2014/oct/12/tony-perkins/tony-perkins-we-know-social-science-children-do-be/,— PunditFact,False,Tony Perkins,"""We know from the social science that children do best with a mom and a dad."""
858,"on Friday, October 10th, 2014",An estimate of an estimate,/punditfact/statements/2014/oct/10/sarah-silverman/fact-checking-sarah-silvermans-viral-vagina-tax-vi/,— PunditFact,Half-True,Sarah Silverman,"""Every year the average woman loses around $11,000 to the wage gap,"" which amounts to ""a $500,000 vagina tax"" over her working career."
859,"on Wednesday, October 8th, 2014",Truth is the best disinfectant for this rumor,/punditfact/statements/2014/oct/08/morgan-brittany/did-washington-tell-responders-prep-ebola-months-a/,— PunditFact,Pants on Fire!,Morgan Brittany,"""According to a government supplier of emergency products, the Disaster Assistance Response Team was told to be prepared to be activated in the month of October for an outbreak of Ebola."""
860,"on Wednesday, October 8th, 2014",Obscures the broader Muslim condemnation of 9/11,/punditfact/statements/2014/oct/08/bill-oreilly/oreilly-no-muslim-government-called-out-those-who-/,— PunditFact,Half-True,Bill O'Reilly,"Muslim nations did not ""call out"" the people who celebrated the 9/11 attacks."
861,"on Tuesday, October 7th, 2014","ISIS is small, but not Double A small",/punditfact/statements/2014/oct/07/ben-affleck/ben-afflecks-claim-isis-couldnt-fill-double-ball-p/,— PunditFact,False,Ben Affleck,"The Islamic State is so small it ""couldn't fill a Double A ballpark in Charleston, W. Va."""
862,"on Tuesday, October 7th, 2014","Yep, it's the one and only",/punditfact/statements/2014/oct/07/dean-obeidallah/obeidallah-saudi-arabia-only-muslim-nation-where-w/,— PunditFact,True,Dean Obeidallah,"Saudi Arabia is ""the only Muslim country out of 47 Muslim-majority countries"" where women cannot get licenses to drive."
863,"on Tuesday, October 7th, 2014",Her numbers are right,/punditfact/statements/2014/oct/07/gloria-steinem/steinem-more-women-killed-partners-911-deaths-atta/,— PunditFact,True,Gloria Steinem,"More women were killed by their husbands or boyfriends since Sept. 11 than ""all the Americans who were killed by 9/11 or in Afghanistan and Iraq."""
864,"on Monday, October 6th, 2014","7 would be more accurate, maybe more",/punditfact/statements/2014/oct/06/dick-cheney/cheney-army-has-just-4-combat-ready-brigades/,— PunditFact,Mostly False,Dick Cheney,"""We have four combat-ready brigades out of 40 in the U.S. Army."""
865,"on Sunday, October 5th, 2014","A sustained surge under Clinton, too",/punditfact/statements/2014/oct/05/george-will/george-will-america-hasnt-had-sustained-confidence/,— PunditFact,False,George Will,"""The last time there was a sustained surge of confidence in government's competence was under Ronald Reagan."""
866,"on Thursday, October 2nd, 2014",The practice is not exclusive to Islam,/punditfact/statements/2014/oct/02/reza-aslan/fact-checking-reza-aslans-retort-bill-maher/,— PunditFact,Mostly True,Reza Aslan,"Says female genital mutilation is ""a central African problem,"" not an Islamic problem, as Bill Maher suggested."
867,"on Wednesday, October 1st, 2014",The distortion here is what Huber claims Feeding America said,/punditfact/statements/2014/oct/01/william-benson-huber/ny-post-op-ed-rebuts-starving-children-claim-was-n/,— PunditFact,Pants on Fire!,William Benson Huber,"The non-profit group Feeding America is lying when it claims ""that one in five kids is fighting starvation daily"" in the United States."
868,"on Tuesday, September 30th, 2014",Wasn't true when Obama said it either,/punditfact/statements/2014/sep/30/jane-harman/jane-harman-incorrectly-claims-fast-and-furious-gu/,— PunditFact,False,Jane Harman,"The Justice Department’s Fast and Furious gun-walking program ""started in the Bush administration."""
869,"on Monday, September 29th, 2014",It's both worse and better,/punditfact/statements/2014/sep/29/emma-watson/watson-155-million-women-will-marry-children/,— PunditFact,Half-True,Emma Watson,"Based on current trends, ""15.5 million girls will be married in the next 16 years as children."""
870,"on Sunday, September 28th, 2014","Bad dates, bad history ",/punditfact/statements/2014/sep/28/laura-ingraham/current-congress-adjourned-earlier-election-year-a/,— PunditFact,False,Laura Ingraham,"This Congress ""adjourned earliest of any time in congressional history before an election."""
871,"on Sunday, September 28th, 2014","Angering his base, Granderson says",/punditfact/statements/2014/sep/28/lz-granderson/lz-granderson-obama-has-bombed-twice-many-muslim-c/,— PunditFact,Mostly True,LZ Granderson,"Says President Barack Obama has launched ""twice as many strikes (on) countries that are predominantly Muslim"" than President George W. Bush."
872,"on Thursday, September 25th, 2014",This is speculation,/punditfact/statements/2014/sep/25/ralph-peters/fox-analyst-airstrikes-syria-conducted-night-minim/,— PunditFact,Mostly False,Ralph Peters,"Says President Barack Obama attacked potential terrorist targets in Syria in the middle of the night ""to minimize terrorist casualties."""
873,"on Thursday, September 25th, 2014","More places, fewer bombs",/punditfact/statements/2014/sep/25/ryan-lizza/lizza-says-obama-has-bombed-more-nations-bush/,— PunditFact,True,Ryan Lizza,"""Countries bombed: Obama 7, Bush 4"""
874,"on Wednesday, September 24th, 2014",Let's go to the video,/punditfact/statements/2014/sep/24/rachel-maddow/rachel-maddow-not-even-old-gen-eisenhower-saluted-/,— PunditFact,Mostly False,Rachel Maddow,"""Not even old Gen. Eisenhower … saluted military personnel"" as president."
875,"on Tuesday, September 23rd, 2014","ISIS getting more than 1,600 troops",/punditfact/statements/2014/sep/23/brit-hume/hume-obama-put-more-force-combatting-ebola-isis/,— PunditFact,False,Brit Hume,"Says President Barack Obama is ""sending a much larger (force) "" to deal with Ebola ""than ISIS is getting."""
876,"on Sunday, September 21st, 2014",Americans want limited action,/punditfact/statements/2014/sep/21/katrina-vanden-heuvel/katrina-vanden-heuvel-americans-support-air-strike/,— PunditFact,Half-True,Katrina vanden Heuvel,"Americans now ""support strikes (against ISIS) but the support for ground troops is not there. The support is very thin."""
877,"on Sunday, September 21st, 2014","""Football will outlive all of us""",/punditfact/statements/2014/sep/21/george-will/george-will-top-3-shows-us-last-week-were-nfl-game/,— PunditFact,True,George Will,"""Last week's three most-viewed television programs were Sunday Night Football, Thursday Night Football and Monday Night Football."""
878,"on Friday, September 19th, 2014","Suits are one-time use, bound for Africa",/punditfact/statements/2014/sep/19/blog-posting/infowars-us-ordering-16000-hazmat-suits-sign-ebola/,— PunditFact,Half-True,Bloggers,"""The U.S. State Department has ordered 160,000 Hazmat suits for Ebola, prompting concerns that the federal government is anticipating the rapid spread"" of the virus."
879,"on Thursday, September 18th, 2014","20 years later, still no",/punditfact/statements/2014/sep/18/mika-brzezinski/mika-brzezinski-repeats-myth-super-bowl-sunday-has/,— PunditFact,Pants on Fire!,Mika Brzezinski,"""Super Bowl Sunday has the highest rate of domestic violence."""
880,"on Thursday, September 18th, 2014",A clear tilt,/punditfact/statements/2014/sep/18/media-matters/media-matters-says-fox-gives-gop-senators-twice-mu/,— PunditFact,True,Media Matters,Says Fox News gave Republican senators twice the air time as Democrats during a hearing about the Islamic State.
881,"on Thursday, September 18th, 2014","Eventually, the White House says",/punditfact/statements/2014/sep/18/julie-pace/justify-airstrikes-against-islamic-state-obama-usi/,— PunditFact,Mostly True,Julie Pace,"The Obama administration is using as its ""legal justification for these airstrikes (on the Islamic State), an authorization for military force that the president himself has called for repeal of."""
882,"on Wednesday, September 17th, 2014",Studies show spankings are common,/punditfact/statements/2014/sep/17/donald-trump/trump-more-half-parents-spank-their-kids/,— PunditFact,Mostly True,Donald Trump,"""Much more than 50 percent of parents out there are spankers."""
883,"on Tuesday, September 16th, 2014","Spot on, experts say",/punditfact/statements/2014/sep/16/james-brown/cbs-sports-james-brown-more-3-women-day-are-killed/,— PunditFact,True,James Brown,"""More than three women per day lose their lives at the hands of their partners."""
884,"on Monday, September 15th, 2014",An indirect link,/punditfact/statements/2014/sep/15/chris-matthews/matthews-cheneys-post-saddam-tactic-created-isis/,— PunditFact,Mostly False,Chris Matthews,"Says Dick Cheney ""de-Ba’athisized the Iraqi government and created ISIS."""
885,"on Sunday, September 14th, 2014",Though experts question the comparison,/punditfact/statements/2014/sep/14/mike-wise/did-nfl-commissioner-roger-goodell-interview-janay/,— PunditFact,Mostly True,Mike Wise,"Says NFL Commissioner Roger Goodell interviewed domestic abuse victim Janay Rice with Ray Rice present and for ""every domestic violence agency, every law enforcement agency, that’s a no-no."""
886,"on Sunday, September 14th, 2014","Dentists, radio reporters and teachers, too",/punditfact/statements/2014/sep/14/michael-hayden/former-cia-director-obama-said-syrian-opposition-w/,— PunditFact,True,Michael Hayden,"""The president referred to the Syrian opposition just a few months ago as pharmacists and doctors, and so on."""
887,"on Friday, September 12th, 2014",Republicans have bounced back in recent polls,/punditfact/statements/2014/sep/12/maria-cardona/liberal-pundit-gop-has-worst-reputation-american-p/,— PunditFact,Half-True,Maria Cardona,"""The Republican Party has the worst reputation in American polling of any political party in history."""
888,"on Thursday, September 11th, 2014","An old claim, recycled",/punditfact/statements/2014/sep/11/facebook-posts/facebook-post-claims-us-flight-canceled-after-terr/,— PunditFact,Pants on Fire!,Facebook posts,"A flight from Atlanta to Houston was canceled due to a ""terrorist dry run."""
889,"on Thursday, September 11th, 2014",Extremely wishful thinking,/punditfact/statements/2014/sep/11/henry-kissinger/kissinger-drones-have-killed-more-civilians-bombin/,— PunditFact,False,Henry Kissinger,"""There were fewer civilian casualties in Cambodia than there have been from American drone attacks."""
890,"on Wednesday, September 10th, 2014","An unscientific poll, but nothing out there better",/punditfact/statements/2014/sep/10/arianna-huffington/huffington-20-young-adults-use-smartphones-during-/,— PunditFact,Mostly True,Arianna Huffington,"A poll found that ""20% of young adults use (smartphones) during sex."""
891,"on Wednesday, September 10th, 2014","Not pulled out of thin air, but not accurate",/punditfact/statements/2014/sep/10/facebook-posts/facebook-post-claims-fox-admits-they-lie-have-righ/,— PunditFact,False,Facebook posts,"""Fox admits they lie"" and, under the First Amendment, ""have the right to lie or deliberately distort news reports on public airwaves."""
892,"on Tuesday, September 9th, 2014",Closest estimate puts U.S. in middle of the pack,/punditfact/statements/2014/sep/09/bob-beckel/does-us-have-more-corporate-tax-deductions-any-oth/,— PunditFact,False,Bob Beckel,"The United States has ""the most number of deductions available to corporations"" for the corporate income tax."
893,"on Tuesday, September 9th, 2014","Officially, U.S. rate is high, though firms usually pay less",/punditfact/statements/2014/sep/09/eric-bolling/does-us-have-highest-corporate-tax-rate-free-world/,— PunditFact,Mostly True,Eric Bolling,"The United States has ""the highest corporate tax rate in the free world."""
894,"on Monday, September 8th, 2014",G.W. Bush did the gutting,/punditfact/statements/2014/sep/08/dana-loesch/loesch-obama-slashed-funding-gun-safety-program/,— PunditFact,False,Dana Loesch,"""Obama admin gutted @ProjChildSafe budget to provide trigger locks and safety kits."""
895,"on Sunday, September 7th, 2014",Crunching the numbers in the toss-up states,/punditfact/statements/2014/sep/07/chuck-todd/chuck-todd-said-8-9-states-toss-senate-races-are-l/,— PunditFact,True,Chuck Todd,"""Eight out of the nine states with competitive Senate races, Hispanics make up less than 10 percent of the electorate."""
896,"on Wednesday, September 3rd, 2014","A wild, outdated claim",/punditfact/statements/2014/sep/03/facebook-posts/blogger-claims-mcdonalds-burgers-are-made-85-perce/,— PunditFact,Pants on Fire!,Facebook posts,"""McDonald’s hamburgers are only 15 percent ‘real beef.’ The other 85 percent is meat filler cleansed with ammonia, which causes stomach and intestinal cancer."""
897,"on Wednesday, September 3rd, 2014",Adds a new angle to the Happy Meal,/punditfact/statements/2014/sep/03/other-98/can-you-make-45000year-mcdonalds-denmark/,— PunditFact,Mostly True,The Other 98%,"""McDonald’s workers in Denmark have a union. Earn $45,000/year."""
898,"on Tuesday, September 2nd, 2014",Buying power ≠ GDP,/punditfact/statements/2014/sep/02/larry-elder/larry-elder-if-black-america-were-country-itd-be-1/,— PunditFact,False,Larry Elder,"""If black America were a country, it’d be the 15th wealthiest nation in the world."""
899,"on Sunday, August 31st, 2014",Political ties are pretty loose -- to either party,/punditfact/statements/2014/aug/31/tom-delay/tom-delay-says-prosecutor-who-brought-rick-perry-i/,— PunditFact,Mostly False,Tom DeLay,"The prosecutor who brought the indictment of Texas Gov. Rick Perry ""has ties to Obama. He has ties to the Democrats."""
900,"on Friday, August 29th, 2014",Not if you read the WSJ editorial,/punditfact/statements/2014/aug/29/chris-matthews/does-wall-street-journal-really-oppose-burger-king/,— PunditFact,False,Chris Matthews,"On tax inversions, the Wall Street Journal ""surprisingly attacked this tax scheme."""
901,"on Thursday, August 28th, 2014",Basically matches Sharpton's remarks,/punditfact/statements/2014/aug/28/megyn-kelly/megyn-kelly-al-sharpton-declared-michael-brown-did/,— PunditFact,True,Megyn Kelly,"Al Sharpton went to Ferguson, Mo., and is ""declaring as a matter of fact that ... Michael Brown didn't use any deadly force or posed no deadly threat to the officer."""
902,"on Tuesday, August 26th, 2014",Update: Hill says he misspoke,/punditfact/statements/2014/aug/26/marc-lamont-hill/unarmed-black-person-shot-every-28-hours-says-ma/,— PunditFact,False,Marc Lamont Hill,"""Every 28 hours"" an unarmed black person is shot by a cop."
903,"on Tuesday, August 26th, 2014",Shooting from the hip,/punditfact/statements/2014/aug/26/don-lemon/cnns-lemon-says-automatic-weapons-are-easy-get/,— PunditFact,False,Don Lemon,"""I was able to go and buy an automatic weapon … Most people can go out and buy an automatic weapon."""
904,"on Tuesday, August 26th, 2014",3 hours vs. 3 days,/punditfact/statements/2014/aug/26/cornel-west/cornel-west-obama-reacted-quicker-robin-williams-d/,— PunditFact,True,Cornel West,"Says President Barack Obama released a statement on the ""death of brother Robin Williams before ... a statement on brother Michael Brown."""
905,"on Tuesday, August 26th, 2014","Blaming the Fed is peculiar, economists say",/punditfact/statements/2014/aug/26/herman-cain/herman-cain-says-wages-flat-thanks-federal-reserve/,— PunditFact,Mostly False,Herman Cain,"""Over the last 40 years, real wage growth has been flatlined because of the policies of the Federal Reserve ... It was all driven by the Federal Reserve."""
906,"on Sunday, August 24th, 2014",It did not last long,/punditfact/statements/2014/aug/24/martha-raddatz/obama-wanted-keep-10000-troops-iraq-abcs-raddatz-c/,— PunditFact,Mostly True,Martha Raddatz,"The Obama administration originally ""wanted 10,000 troops to remain in Iraq -- not combat troops, but military advisers, special operations forces, to watch the counterterrorism effort."""
907,"on Sunday, August 24th, 2014",Homicide accounted for 40 percent of deaths in the age group ,/punditfact/statements/2014/aug/24/juan-williams/juan-williams-no-1-cause-death-african-americans-1/,— PunditFact,True,Juan Williams,The No. 1 cause of death for African-American males 15-34 is murder.
908,"on Thursday, August 21st, 2014",Ignores that whites far outnumber blacks,/punditfact/statements/2014/aug/21/michael-medved/talk-show-host-police-kill-more-whites-blacks/,— PunditFact,Half-True,Michael Medved,"""More whites than blacks are victims of deadly police shootings."""
909,"on Thursday, August 21st, 2014",Same problem since at least 1954,/punditfact/statements/2014/aug/21/lou-dobbs/black-unemployment-three-times-higher-ferguson-bec/,— PunditFact,False,Lou Dobbs,"Because of President Barack Obama’s failure to ""push job creation,"" the black unemployment rate in Ferguson, Mo., is three times higher than the white unemployment rate."
910,"on Wednesday, August 20th, 2014","Aired video before CNN, Fox",/punditfact/statements/2014/aug/20/rush-limbaugh/limbaugh-msnbc-went-air-after-news-michael-brown-w/,— PunditFact,False,Rush Limbaugh,"When news broke that Ferguson 18-year-old Michael Brown was a suspect in a robbery, ""MSNBC practically went off the air for a while to have behind-closed-doors meetings to figure out how to deal with this new revelation."""
911,"on Wednesday, August 20th, 2014",Bottom's up! (off camera),/punditfact/statements/2014/aug/20/heineken/neil-patrick-harris-heineken-ad-we-cant-drink-tv/,— PunditFact,Mostly True,Heineken,"A ""regulatory thing"" means you can’t show someone drinking beer on camera."
912,"on Tuesday, August 19th, 2014",'Operation Hornet's Nest' is a conspiracy rabbit hole,/punditfact/statements/2014/aug/19/blog-posting/edward-snowden-leaked-nsa-documents-show-us-israel/,— PunditFact,Pants on Fire!,Bloggers,"Documents released by Edward Snowden reveal that American, British and Israeli intelligence agencies worked together to create the Islamic State."
913,"on Monday, August 18th, 2014","Data isn't perfect, but it's the best we have",/punditfact/statements/2014/aug/18/john-oliver/segment-ferguson-john-oliver-says-swat-raids-are-1/,— PunditFact,Mostly True,John Oliver,"""The number of SWAT raids have gone up by 1,400 percent since the 1980s."""
914,"on Sunday, August 17th, 2014",Mayor says recruiting African-American officers is tough,/punditfact/statements/2014/aug/17/andrea-mitchell/ferguson-police-department-has-50-white-officers-t/,— PunditFact,Mostly True,Andrea Mitchell,"In Ferguson, Mo., ""you've got three black officers and 50 white officers with a town that is 67 percent African-American."""
915,"on Friday, August 15th, 2014","Deceptive, also wrong",/punditfact/statements/2014/aug/15/tucker-carlson/carlson-guns-dont-kill-people-bathtubs-do/,— PunditFact,Pants on Fire!,Tucker Carlson,"""Far more children died last year drowning in their bathtubs than were killed accidentally by guns."""
916,"on Thursday, August 14th, 2014",Not the chief's wife,/punditfact/statements/2014/aug/14/tweets/ferguson-police-chiefs-wife-calls-african-american/,— PunditFact,Pants on Fire!,Tweets,"The wife of the Ferguson, Mo., police chief said African-Americans in Ferguson ""are feral and violent."""
917,"on Wednesday, August 13th, 2014",More of a turf war than a moral stand,/punditfact/statements/2014/aug/13/david-gregory/david-gregory-al-qaida-cast-isis-too-extreme/,— PunditFact,Mostly True,David Gregory,"The Islamic State, or ISIS, was ""cast off by al-Qaida because"" it was ""considered too extreme."""
